{"closureEdges":[{"dependencyKind":"source-derived-route","fromEdgeId":"surface.native.op.exactgetallenv.1xzi2u1","implementationBranchId":"surface.native.op.exactgetallenv.1xzi2u1.apple","proofPaths":["native-op:__exactGetAllEnv"],"sourceRefs":["src/engine/hermes_runtime.cc#__exactGetAllEnv","src/engine/hermes_runtime.cc#__exactGetAllEnv:apple:_NSGetEnviron","src/engine/hermes_runtime.cc#jsi-global:__exactGetAllEnv"],"terminalObservedKey":"native-op:__exactGetAllEnv","toEdgeId":"surface.native.op.exactgetallenv.1xzi2u1"},{"dependencyKind":"source-derived-route","fromEdgeId":"surface.native.op.exactgetenv.0k6bv7a","implementationBranchId":"surface.native.op.exactgetenv.0k6bv7a.default","proofPaths":["native-op:__exactGetEnv"],"sourceRefs":["src/engine/hermes_runtime.cc#__exactGetEnv","src/engine/hermes_runtime.cc#jsi-global:__exactGetEnv"],"terminalObservedKey":"native-op:__exactGetEnv","toEdgeId":"surface.native.op.exactgetenv.0k6bv7a"},{"dependencyKind":"source-derived-route","fromEdgeId":"surface.native.op.exactsetenv.1785yh6","implementationBranchId":"surface.native.op.exactsetenv.1785yh6.default","proofPaths":["native-op:__exactSetEnv"],"sourceRefs":["src/engine/hermes_runtime.cc#__exactSetEnv","src/engine/hermes_runtime.cc#jsi-global:__exactSetEnv"],"terminalObservedKey":"native-op:__exactSetEnv","toEdgeId":"surface.native.op.exactsetenv.1785yh6"},{"dependencyKind":"source-derived-route","fromEdgeId":"surface.native.op.global.process.env.dynamic.table.env.obj.properties.161cd28","implementationBranchId":"surface.native.op.global.process.env.dynamic.table.env.obj.properties.161cd28.posix","proofPaths":["native-op:global:process.env.[[dynamic-table:env-obj-properties]]"],"sourceRefs":["src/engine/hermes_runtime_process_setup.cc#jsi-global:process.env.[[dynamic-table:env-obj-properties]]"],"terminalObservedKey":"native-op:global:process.env.[[dynamic-table:env-obj-properties]]","toEdgeId":"surface.native.op.global.process.env.dynamic.table.env.obj.properties.161cd28"},{"dependencyKind":"source-derived-route","fromEdgeId":"surface.native.op.global.process.env.dynamic.table.principal.environment.overlay.propertie.0sncb00","implementationBranchId":"surface.native.op.global.process.env.dynamic.table.principal.environment.overlay.propertie.0sncb00.all","proofPaths":["native-op:global:process.env.[[dynamic-table:principal-environment-overlay-properties]]"],"sourceRefs":["packages/ibex-runtime-js/src/node/process.ts#Process.prototype.env","packages/ibex-runtime-js/src/node/process.ts#createEnvProxy","packages/ibex-runtime-js/src/node/process.ts#createEnvProxy:Proxy.deleteProperty","packages/ibex-runtime-js/src/node/process.ts#createEnvProxy:Proxy.get","packages/ibex-runtime-js/src/node/process.ts#createEnvProxy:Proxy.ownKeys","packages/ibex-runtime-js/src/node/process.ts#createEnvProxy:Proxy.set"],"terminalObservedKey":"native-op:global:process.env.[[dynamic-table:principal-environment-overlay-properties]]","toEdgeId":"surface.native.op.global.process.env.dynamic.table.principal.environment.overlay.propertie.0sncb00"}],"expandedCellIds":["surface.native.op.exactgetallenv.1xzi2u1","surface.native.op.exactgetenv.0k6bv7a","surface.native.op.exactsetenv.1785yh6","surface.native.op.global.process.env.dynamic.table.env.obj.properties.161cd28","surface.native.op.global.process.env.dynamic.table.principal.environment.overlay.propertie.0sncb00"],"intensionalDefinition":{"capabilityFamilies":["env"],"surfaceKinds":["native-op"]},"predecessor":{"kind":"genesis"},"profile":"ibex/capsec/1","scopeCellMappingDigest":"sha256-3Qf48JwPu79VXdgpmYkSXj7bD1ONzyrGlMqNdvieK4w","scopeDigest":"sha256-PkNOtZUjUAInU9w2tSrOQYirojBtRC0YHFa7HbayPIE","scopeExpansionDiffDigest":"sha256-h3DYyNgxrfB8fcHpSQxrpr0cGXGBZlcwCPDXQTBzahE","scopeSchema":"ibex/capsec-scope/1","target":{"features":["hermes-frame-attribution","native-compartments","native-lockdown"],"triple":"aarch64-apple-darwin"}}